{"citations":[{"byte_end":51,"byte_start":18,"display_text":"The pause flag halts new entries.","doc":"terms.md","format":"berean-citation/v1","id":"c1","sha256":"a7ad83a7186e2173cdfa707f8d6074f9c8396a40b82f5e8eea0da6c42f6d86dc"}],"discrepancies":[],"format":"berean-answer/v1","kind":"answer","question":"Is the pause flag set?","reads":[{"block_number":1000000,"chain_id":1,"id":"r1","request_key":"09f3801f03223a865535cddb4d7f369646bf1fd2c426dcce8b87e9889294f5fe"}],"refusal":null,"sentences":[{"evidence":["c1"],"source_class":"document","text":"The terms say the pause flag halts new entries."},{"evidence":["r1"],"source_class":"chain_read","text":"Slot zero reads one at the pinned block."},{"evidence":[],"source_class":"user_supplied","text":"You said your desk treats a set flag as a hold."}]}
